Claim Number;Loss Description;AI Loss Cause;AI Damaged Items;AI Place of Occurrence;AI Triage;AI Triage Reasoning;AI Prevailing Document;AI Section/Page Document;AI Coverage (applicable);AI Limit (applicable);AI Reasoning;AI Claim Prediction
HO10024120;Water Damage: drip pan pump;water damage;drip pan pump;;More information needed;The description does not provide sufficient information about where the incident occurred, making it invalid.;;;;;;
HO10030318;Water Damage: water damage - see attached;water damage;;;More information needed;The description does not specify the affected items or the place of occurrence, making it insufficient to determine the details of the incident.;;;;;;
HO10027160;Water Damage: Burning smell coming from the electric box. Lights are flickering.;water damage;;;More information needed;The description does not specify what items were damaged or where the incident occurred. It only mentions symptoms (burning smell, flickering lights) without detailing the affected items or location.;;;;;;
HO10026454;Water Damage: INSURED CALLED AND HAS QUESTIONS ABOUT IF SHE NEEDS TO FILE A CLAIM AND IF THINGS ARE COVERED. COULD SOMEONE PLEASE GIVE INSURED A CALL BACK AT SOME POINT TODAY. SHE LEFT 25 PHONE NUMBERS THAT SHE COULD BE REACHED AT 508-857-9480 OR 774-259-7827;water damage;;;More information needed;The description does not provide specific information about what was damaged or where the incident occurred. It mainly consists of a request for a call back and does not detail the incident itself.;;;;;;
HO10031503;Water Damage: A wet spot on Winters ceiling was found.;water damage;;;More information needed;The description does not provide sufficient information about the cause of the water damage or the specific location of the incident. It only mentions a wet spot on the ceiling without detailing what caused it or where exactly it occurred.;;;;;;
HO10026817;Water Damage: contents damaged by water;water damage;;;More information needed;The description does not specify the location where the incident occurred or the specific items that were damaged.;;;;;;
HO10025890;Water Damage due to Plumbing System: Plumbers came out to replace a washer drain and needed to turn the water off. The turnoff inside the house was not working so they called the city to turn off the main water line. They then discovered that the water main had a leak. There is no damage due to the leak but Janet was told to report to insurance;water damage due to Plumbing System;;inside the house;More information needed;The description indicates that there was a leak in the water main, but it states that there is no damage due to the leak, which makes it unclear what was actually affected or damaged. Therefore, it does not provide sufficient information to validate the claim.;;;;;;
HO10023994;Water Damage: WATER LEAK IN HOUSE DUE TO THE WIND;water damage;;;More information needed;The description does not provide a clear explanation of the specific items that were damaged or the exact location of the incident. It only mentions a water leak due to wind without detailing affected items or a specific place.;;;;;;
HO10027809;Water Damage: WATER DAMAGE;water damage;;;More information needed;The description does not provide specific details about what was damaged or where the incident occurred.;;;;;;
HO10029026;Water Damage: wind/water damage;water damage;;;More information needed;The description does not specify the affected items or the place of occurrence, making it insufficient for validation.;;;;;;
HO10031770;Water Damage: insured has mold. not sure how or where mold is. states she can smell mold. need to call MASS RELAY #711 OR 800-439-0183 AND GIVE INS TEL # 508-357-2702;water damage;;;More information needed;The description does not specify the items that were damaged or the exact location of the incident. It only mentions the presence of mold without detailing what was affected or where it occurred.;;;;;;
HO10030332;Water Damage: NEFF has a leak and is not sure if se is missing shingles due to storm;water damage;;;More information needed;The description does not provide a clear location where the incident occurred and lacks specific details about the affected items. It mentions a leak but does not specify what was damaged.;;;;;;
HO10025540;Water Damage: Haney noticed around the house on the window trim there was some dry roots and mold.;water damage;;;More information needed;The description does not specify the exact cause of the water damage or the specific location of the incident. It only mentions mold and dry roots on the window trim without detailing where the water damage originated or what specific items were affected.;;;;;;
HO10033243;Water Damage: Brown spots in ceiling and bubbling unsure what is causing it.;water damage;;;More information needed;The description does not specify the exact cause of the water damage or the location where the incident occurred. It only mentions symptoms (brown spots and bubbling) without detailing affected items or the place of occurrence.;;;;;;
HO10028421;Water Damage: Flooring damaged. Unknown details.;water damage;Flooring;;More information needed;The description lacks specific information about the place of occurrence and does not provide sufficient details about the cause of the water damage beyond stating 'unknown details'.;;;;;;
HO10024381;Water Damage: Mold under the windows and shingles;water damage;"mold under the windows
shingles";;More information needed;The description does not specify the location where the incident occurred, making it invalid.;;;;;;
HO10024000;Water Damage: there was a water damage, damage to all whole floor. The floor got moose;water damage;whole floor;;More information needed;The description lacks specific details about the cause of the water damage and does not mention the location where the incident occurred. Additionally, 'moose' seems to be a typographical error or irrelevant term, making the description unclear.;;;;;;
HO10029351;Water Damage: I hired a contractor to repair one propane heating furnace and to replace another propane heating furnace. The contractor did not get work permits from town construction authorities. That was unlawful. The contractor does not carry the gas fitter's license. That work was illegal. The contractor refuses to provide the purchasing documentation for the equipment. Now, the property is compromised and jeopardized from the legal point of view.;water damage;;;More information needed;The description does not specify what items were damaged or where the incident occurred. It focuses on legal issues with the contractor rather than the actual damage caused by water.;;;;;;
HO10030360;Water Damage: Balint mentioned that a sewer line between his house and the street caused the water to come back to the basement of his home and he called the United Router Service to fix the sewage in his property but they said it might not hold for a long time so they will need to remove the tree roots in his sewer. There are no damages to Balint's property.;sweage backup;;Balint's home;More information needed;The description states that there are no damages to Balint's property, which contradicts the requirement for a valid incident description to indicate what was damaged.;;;;;;
HO10029564;Water Damage: wind water damage;water damage;;;More information needed;The description does not provide specific details about the affected items or the place of occurrence. It only mentions 'water damage' and 'wind water damage' without clarity on what was damaged or where it happened.;;;;;;
HO10032178;Water Damage: Roof broken opened and rain started coming inside the house. Unknown information of damaged inside the house.;water damage;;inside the house;More information needed;The description does not specify the items that were damaged inside the house, making it insufficient to determine the extent of the damage.;;;;;;
HO10024543;Water Damage: Water and sump pump overflow.;water damage;;;More information needed;The description does not specify the affected items or the place of occurrence, making it insufficient for a valid claim.;;;;;;
HO10028383;Water Damage: Extensive water damage;water damage;;;More information needed;The description does not specify what items were damaged or where the incident occurred, making it insufficient for a valid claim.;;;;;;
HO10030646;Water Damage: O'Connor had a foul odor in one of the bedrooms. O'Connor had an environmental company come out to do some tests.;water damage;;;More information needed;The description does not specify the cause of the water damage or what specific items were affected. It also lacks a clear indication of where the incident occurred beyond mentioning 'one of the bedrooms.';;;;;;
HO10031129;Water Damage: Therenciel heard water dripping from ceiling;water damage;;;More information needed;The description does not specify the place of occurrence or list the affected items clearly. It only mentions water dripping from the ceiling without further details.;;;;;;
HO10034350;Water Damage: hidden mold;water damage;;;More information needed;The description does not specify what items were affected or where the incident occurred, making it insufficient for a valid claim.;;;;;;
HO10027138;Water Damage due to Plumbing System: The water pipe from the street into the home burst. ** No water damage to the residence **;water damage due to Plumbing System;;from the street into the home;More information needed;The description states there was no water damage to the residence, which contradicts the claim of water damage due to a plumbing system issue. Therefore, it lacks valid information about what was damaged.;;;;;;
HO10026164;Water Damage: walls got damaged by wind driven rain, unknown where walls damaged in home;water damage;walls;unknown;More information needed;The description does not specify the exact location of the damage within the home, making it difficult to assess the validity of the claim.;;;;;;
HO10029364;Water Damage: WATER ENTERED HOME FROM THE STORM. NOT SURE WHERE THE WATER WAS ABLE TO ENTER.;water damage;;home;More information needed;The description does not specify the exact location of the damage within the home or the specific items that were affected. It only mentions that water entered the home without detailing what was damaged.;;;;;;
HO10027917;Water Damage: FLOREK-BOTTONE noticed water coming down the door frame. She thinks it may be molding;water damage;;;More information needed;The description does not specify the exact cause of the water damage or the location of the incident clearly. It mentions water coming down the door frame but lacks details on where this occurred (e.g., which room or building) and does not list specific affected items.;;;;;;
HO10024998;Water Damage: Blaisdell lives in a condo and the person down stairs had water damage, either by the siding or something with the building she gets water when it rains. Blaisdell has no damage at all and was calling it in for report purpuse only.  they dont know where the water comes from they think is either the siding;water damage;;;More information needed;The description is not valid because it states that Blaisdell has no damage, and the report is for informational purposes only. There is no specific mention of what was damaged or where the incident occurred in relation to Blaisdell's property.;;;;;;
HO10032394;Water Damage: WATER DAMAGE REPORTED;water damage;;;More information needed;The description is too vague and does not specify what items were damaged or where the incident occurred.;;;;;;
HO10032258;Water Damage: oil tank starting to leak;water damage;oil tank;;More information needed;The description does not specify where the incident occurred, and it lacks a comprehensive list of affected items beyond the oil tank.;;;;;;
HO10026967;Water Damage: Scarberry noticed water damage from an unknown source.;water damage;;;More information needed;The description does not specify the place of occurrence or the specific items that were affected by the water damage, making it insufficient for a valid claim analysis.;;;;;;
HO10024528;Water Damage: THE INSURED SAID THAT THE BASEMENT WATER LEAK IN WALL, CEILING AND FLOOR . DUE TO THE WIND;water damage;"wall
ceiling
floor";basement;More information needed;The description does not clearly specify the cause of the water damage, as it states 'due to the wind' which is not a valid cause for water damage. Additionally, it lacks a specific location for the incident beyond mentioning the basement.;;;;;;
HO10027827;Water Damage: EARLY noticed there was a satin on the fire place hertz;water damage;;;More information needed;The description is not valid because it does not clearly state the cause of the water damage or provide sufficient details about the affected items and the location of the incident. The term 'satin on the fire place hertz' is unclear and does not specify what was damaged or where exactly the incident occurred.;;;;;;
HO10029870;Water Damage: water came in thru ground level - cause uncertain;water damage;;;More information needed;The description does not specify the exact items that were affected or damaged, nor does it provide a clear location where the incident occurred.;;;;;;
HO10029028;Water Damage: water leaking out of the floor;water damage;;;More information needed;The description does not specify the location where the incident occurred or the specific items that were affected by the water damage.;;;;;;
HO10028750;Water Damage: Jeglinski does not know where the rain is blowing in and coming in on the from portch making it all wet,;water damage;;porch;More information needed;The description does not specify the exact location of the incident or list specific items that were damaged. It only mentions a general area (the porch) and the effect (wetness) without detailing what was affected.;;;;;;
HO10027407;Water Damage: INSURED NOTICED MOLD PRESENCE UNKNOWN SOURCE;water damage;;;More information needed;The description does not specify the location where the incident occurred or the specific items that were affected by the water damage.;;;;;;
HO10032871;Water Damage: doors windows- dry rot;water damage;"doors
windows";;More information needed;The description does not specify where the incident occurred, making it invalid.;;;;;;
HO10024426;Water Damage: WATER DAMAGE;water damage;;;More information needed;The description lacks specific details about what items were damaged and where the incident occurred.;;;;;;
HO10028268;Water Damage: moister on the inside of the window sill;water damage;;;More information needed;The description does not provide enough information about the specific items that were damaged or the exact location of the incident. It only mentions moisture on the window sill without detailing what was affected or where the incident occurred.;;;;;;
HO10032032;Water Damage: They placing windows and doors and Dry Rot was discovered .;water damage;;;More information needed;The description does not specify where the incident occurred, and it lacks details about the specific items that were damaged.;;;;;;
HO10027324;Water Damage: Mold in shed.;water damage;mold;;More information needed;The description does not specify the cause of the water damage or the location of the shed, making it insufficient to determine validity.;;;;;;
HO10031894;Water Damage due to Plumbing System: Bedrossian has hidden water damage under the tile due to a possible;water damage due to Plumbing System;;;More information needed;The description is incomplete and does not specify the affected items or the exact location of the incident.;;;;;;
HO10024109;Water Damage: WATER LEAK;water damage;;;More information needed;The description does not specify the affected items or the place of occurrence, making it insufficient for validation.;;;;;;
HO10025680;Water Damage: not sure what caused water damage in basement;water damage;;basement;More information needed;The description does not specify the exact cause of the water damage or the specific items that were affected, making it insufficiently detailed to be considered valid.;;;;;;
HO10034301;Water Damage: during a home inspection, mold was found;water damage;;;More information needed;The description does not specify what items were damaged or where the incident occurred. It only mentions mold found during a home inspection without details on the source of water damage or the location.;;;;;;
HO10025641;Water Damage: Due to a Torrential Down Pouring and Thundering. The water got into the foundation of the basement and through the cracks of the walls it got into the whole basement floors which are made out of Vinyl flooring. There is also wall damage.;water damage;"vinyl flooring
walls";basement;Enough information;The description provides clear information about the cause of the damage (water damage due to torrential downpour), the affected items (vinyl flooring and walls), and implies the location (basement).;4013335957_51e5d03a1b4f02384812_NIL_Renewal.pdf;"CIC-2226-202202-AdvantageEliteExended page 5
Homeowners-3-Special-Form_HO0003_201105 page 12
Homeowners-3-Special-Form_HO0003_201105 page 10";;;The incident involves water damage caused by a torrential downpour, which led to water entering the foundation and damaging the basement floors and walls. However, the relevant policy documents contain specific exclusions regarding water damage. For instance, the Homeowners-3-Special-Form (HO0003) explicitly states that water damage caused by flooding, surface water, or water that backs up through sewers or drains is excluded from coverage. Additionally, the CIC-2226-202202-AdvantageEliteExended document includes a water exclusion that states water damage from flooding or water below the surface of the ground is not covered. Given these exclusions, the water damage described in the incident is not covered under any of the provided policies.;Not covered/Excluded
HO10018601;Water Damage: DAMPNESS FROM ABOVE NEIGHBOR'S FLOOR CAUSED MOLD TO INSURED'S CEILING IN LIVING ROOM;water damage;ceiling;living room;Enough information;The description provides clear information about the cause of the damage (water damage from above), the affected item (insured's ceiling), and the location (living room).;4067808078_156f7b8da96818564331_NIL_Renewal.pdf;"Unit-Owners-Coverage-A_HO1732_201702 page 2
Unit-Owners-Coverage-C_HO1731_201105 page 2
Unit-Owners-Coverage-C_HO1731_201105 page 3
HO0539-0511-LimitedFungi-WetOrDryRot-OrBacteria page 1
Homeowner-6-Unit-Owners-Form_HO0006_201105 page 9";Coverage A : Dwelling;10000;The incident involves water damage caused by dampness from the neighbor's floor, which led to mold growth on the insured's ceiling. According to the policy documents, particularly the sections related to mold, fungus, or wet rot, coverage is provided for loss caused by mold that results from an accidental discharge or overflow of water from plumbing systems or appliances on the residence premises or from storm drains or water pipes off the premises. The relevant sections indicate that if the mold is hidden within the walls or ceilings and results from such water damage, it is covered. Since the incident description specifies that the mold was caused by dampness from above, it aligns with the conditions under which coverage is provided. Therefore, the claim is covered under the applicable policies that address mold and water damage.;Covered
HO10024666;Water Damages due to Appliance Failure: AC UNIT CONDENSER, IN THE ATTIC, WAS LEAKING. THE DRIP PAN WAS NOT DRAINING PROPERLY. WATER LEAKED INTO THE CEILING, CAUSING DAMAGE. AC UNIT HAS BEEN CORRECTED. A COMPANY CAME OUT TODAY TO PROVIDE A CEILING ESTIMATE.;water damage due to Appliance Failure;"AC unit condenser
ceiling";attic;Enough information;The description provides clear information about the cause of the damage (appliance failure), the affected item (AC unit condenser), and the location (attic and ceiling).;4096875352_963338ef7b7e12055151_NIL_Endorsements.pdf;"Escaped-Liquid-Fuel_CIC-2193_202001 page 1
Escaped-Liquid-Fuel_CIC-2193_202001 page 2
HSB-SLC-202202-ServiceLineCoverage page 1
HSB-SLC-202202-ServiceLineCoverage page 2
HSB-EBH-202202-HomeSystemsProtection page 1
HSB-EBH-202202-HomeSystemsProtection page 2
HO0538-0511-LimitedFungi-WetOrDryRot-OrBacteria page 2
Homeowners-3-Special-Form_HO0003_201105 page 10
Homeowners-3-Special-Form_HO0003_201105 page 11";;;"The incident involves water damage caused by an appliance failure, specifically a leaking AC unit condenser. The relevant policy sections were reviewed to determine if any coverage applies to this type of incident. The following points were considered:

1. **Escaped-Liquid-Fuel Coverage**: This section pertains specifically to fuel systems and does not cover water damage from appliances. Therefore, it is not applicable to the incident.

2. **Service Line Coverage**: This coverage addresses damage to exterior underground piping and wiring, which does not include internal appliance failures or leaks. Thus, it does not apply to the water damage caused by the AC unit.

3. **Home Systems Protection**: This endorsement covers breakdowns of home equipment but specifically excludes damage caused by wear and tear or mechanical breakdowns. Since the AC unit's failure is categorized as a mechanical breakdown, it is not covered under this policy.

4. **Homeowners Policy Exclusions**: The homeowners policy outlines exclusions for water damage caused by plumbing systems and household appliances, specifically stating that it does not cover damage from leaks unless they are sudden and accidental. The incident described does not meet this criterion as it was due to a failure in the drip pan drainage, which is considered a maintenance issue rather than a sudden event.

5. **Limited Water Back-Up Coverage**: This coverage applies to water damage caused by back-ups from sewers or drains, which is not relevant to the incident as the water damage was due to an appliance failure.

Given these considerations, none of the provided policies cover the incident of water damage from the AC unit failure, leading to the conclusion that the claim is not covered.";Not covered/Excluded
HO10032208;Water Damages due to Appliance Failure: Tenants were using the dishwater and it broke, causing a leak and water damage to the floor of the insured unit / ceiling of the below unit.;water damage due to Appliance Failure;"floor of the insured unit
ceiling of the below unit";insured unit / ceiling of the below unit;Enough information;The description provides clear information about the cause of the water damage (appliance failure), specifies the affected items (floor of the insured unit and ceiling of the below unit), and indicates the location (insured unit and below unit).;4098949831_e82623e8712008575877_NIL_Endorsements.pdf;Unit-Owners-Coverage-A_HO1732_201702 page 9;Coverage A : Dwelling;10000;The incident involves water damage caused by the failure of a household appliance (the dishwasher). According to the policy documents, specifically the section on 'Accidental Discharge Or Overflow Of Water Or Steam', coverage is provided for losses resulting from the accidental discharge or overflow of water from a household appliance on the residence premises. The incident description confirms that the dishwasher broke and caused a leak, which aligns with the conditions outlined in the policy. Therefore, the claim is covered under the relevant policy provisions that address water damage due to appliance failure.;Covered
HO10030845;Water Damage: The strong wind and rains from the last few days knocked a ton of shingles off the roof and now water damage on the second floor roof and insulation in the addict.;water damage;"second floor roof
insulation in the attic";the house;Enough information;The description provides clear information about the incident, including the cause (water damage due to roof damage from wind and rain), the affected items (second floor roof and insulation in the attic), and implies the location (the house).;4102888055_90473b06e46617211477_NIL_Renewal.pdf;"HSB-SLC-202202-ServiceLineCoverage page 2
HSB-SLC-202202-ServiceLineCoverage page 3
HSB-EBH-202202-HomeSystemsProtection page 4
CIC-2226-202202-AdvantageEliteExended page 5
HO0538-0511-LimitedFungi-WetOrDryRot-OrBacteria page 2
Advisory-Notice_CIC-2194_202001 page 1
Home-Sharing-Host-Activities-Amend-End_HO0653_201702 page 1
Home-Sharing-Host-Activities-Amend-End_HO0653_201702 page 2
Tenants-Relocation-Expense-Massachusetts_HO2371_200507 page 1
Lead-Poisioning-Exclusion-MA_HO2441_200109 page 1
Residence-Premises-Def-End_HO0648_201510 page 1
HO0120-0221-SpecialProvisions-MA page 1
Homeowners-3-Special-Form_HO0003_201105 page 12
Homeowners-3-Special-Form_HO0003_201105 page 3
Homeowners-3-Special-Form_HO0003_201105 page 11";;;The incident involves water damage caused by strong winds and rain, which resulted in shingles being knocked off the roof. The relevant policy sections reviewed include those that outline coverage for service line failures, home systems protection, and general homeowners insurance. However, the policies contain specific exclusions for water damage caused by flooding, surface water, or water that backs up through sewers or drains. The water damage described in the incident appears to be a result of the wind and rain, which does not fall under the definitions of covered perils in the policies. Additionally, the homeowners policy explicitly excludes coverage for water damage resulting from flooding or surface water, which is applicable in this case. Therefore, since none of the policies provide coverage for the type of water damage described, the claim is not covered.;Not covered/Excluded
